{
  "report_code": "LM_XB400",
  "report_date": "2023-08-07",
  "run": "AM",
  "current_volume": {
    "central": {
      "loads": 0.0,
      "pounds": 0
    },
    "national": {
      "loads": 11.42,
      "pounds": 456845
    }
  },
  "sections": {
    "markets": [
      {
        "market_key": "central",
        "lines": [
          {
            "category": "Chemical Lean",
            "lean_label": "Fresh 75%",
            "trades": 0,
            "pounds": 0,
            "low": 0.0,
            "high": 0.0,
            "weighted_average": 0.0
          },
          {
            "category": "Chemical Lean",
            "lean_label": "Frozen 75%",
            "trades": 0,
            "pounds": 0,
            "low": 0.0,
            "high": 0.0,
            "weighted_average": 0.0
          },
          {
            "category": "Chemical Lean",
            "lean_label": "Fresh 73%",
            "trades": 0,
            "pounds": 0,
            "low": 0.0,
            "high": 0.0,
            "weighted_average": 0.0
          },
          {
            "category": "Chemical Lean",
            "lean_label": "Frozen 73%",
            "trades": 0,
            "pounds": 0,
            "low": 0.0,
            "high": 0.0,
            "weighted_average": 0.0
          }
        ]
      },
      {
        "market_key": "national",
        "lines": [
          {
            "category": "Chemical Lean",
            "lean_label": "Fresh 75%",
            "trades": 0,
            "pounds": 0,
            "low": 0.0,
            "high": 0.0,
            "weighted_average": 0.0
          },
          {
            "category": "Chemical Lean",
            "lean_label": "Frozen 75%",
            "trades": 0,
            "pounds": 0,
            "low": 0.0,
            "high": 0.0,
            "weighted_average": 0.0
          },
          {
            "category": "Chemical Lean",
            "lean_label": "Fresh 73%",
            "trades": 0,
            "pounds": 0,
            "low": 0.0,
            "high": 0.0,
            "weighted_average": 0.0
          },
          {
            "category": "Chemical Lean",
            "lean_label": "Frozen 73%",
            "trades": 0,
            "pounds": 0,
            "low": 0.0,
            "high": 0.0,
            "weighted_average": 0.0
          },
          {
            "category": "Chemical Lean",
            "lean_label": "Fresh 50%",
            "trades": 0,
            "pounds": 0,
            "low": 0.0,
            "high": 0.0,
            "weighted_average": 0.0
          },
          {
            "category": "Chemical Lean",
            "lean_label": "Frozen 50%",
            "trades": 0,
            "pounds": 0,
            "low": null,
            "high": null,
            "weighted_average": null
          }
        ]
      }
    ]
  }
}