{
  "report_code": "LM_XB400",
  "report_date": "2025-10-17",
  "run": "AM",
  "current_volume": {
    "central": {
      "loads": 7.34,
      "pounds": 293440
    },
    "national": {
      "loads": 23.63,
      "pounds": 945354
    }
  },
  "sections": {
    "markets": [
      {
        "market_key": "central",
        "lines": [
          {
            "category": "Chemical Lean",
            "lean_label": "Fresh 75%",
            "trades": 0,
            "pounds": 0,
            "low": null,
            "high": null,
            "weighted_average": null
          },
          {
            "category": "Chemical Lean",
            "lean_label": "Frozen 75%",
            "trades": 0,
            "pounds": 0,
            "low": null,
            "high": null,
            "weighted_average": null
          },
          {
            "category": "Chemical Lean",
            "lean_label": "Fresh 73%",
            "trades": 0,
            "pounds": 0,
            "low": null,
            "high": null,
            "weighted_average": null
          },
          {
            "category": "Chemical Lean",
            "lean_label": "Frozen 73%",
            "trades": 0,
            "pounds": 0,
            "low": null,
            "high": null,
            "weighted_average": null
          }
        ]
      },
      {
        "market_key": "national",
        "lines": [
          {
            "category": "Chemical Lean",
            "lean_label": "Fresh 75%",
            "trades": 0,
            "pounds": 0,
            "low": null,
            "high": null,
            "weighted_average": null
          },
          {
            "category": "Chemical Lean",
            "lean_label": "Frozen 75%",
            "trades": 0,
            "pounds": 0,
            "low": null,
            "high": null,
            "weighted_average": null
          },
          {
            "category": "Chemical Lean",
            "lean_label": "Fresh 73%",
            "trades": 0,
            "pounds": 0,
            "low": null,
            "high": null,
            "weighted_average": null
          },
          {
            "category": "Chemical Lean",
            "lean_label": "Frozen 73%",
            "trades": 0,
            "pounds": 0,
            "low": null,
            "high": null,
            "weighted_average": null
          },
          {
            "category": "Chemical Lean",
            "lean_label": "Fresh 50%",
            "trades": 0,
            "pounds": 0,
            "low": null,
            "high": null,
            "weighted_average": null
          },
          {
            "category": "Chemical Lean",
            "lean_label": "Frozen 50%",
            "trades": 0,
            "pounds": 0,
            "low": null,
            "high": null,
            "weighted_average": null
          }
        ]
      }
    ]
  }
}