{
  "report_code": "LM_XB400",
  "report_date": "2019-01-08",
  "run": "PM",
  "current_volume": {
    "central": {
      "loads": 2.41,
      "pounds": 96571
    },
    "national": {
      "loads": 11.34,
      "pounds": 453761
    }
  },
  "sections": {
    "markets": [
      {
        "market_key": "central",
        "lines": [
          {
            "category": "Chemical Lean",
            "lean_label": "Fresh 75%",
            "trades": 0,
            "pounds": 0,
            "low": null,
            "high": null,
            "weighted_average": null
          },
          {
            "category": "Chemical Lean",
            "lean_label": "Frozen 75%",
            "trades": 0,
            "pounds": 0,
            "low": null,
            "high": null,
            "weighted_average": null
          },
          {
            "category": "Chemical Lean",
            "lean_label": "Fresh 73%",
            "trades": 0,
            "pounds": 0,
            "low": null,
            "high": null,
            "weighted_average": null
          },
          {
            "category": "Chemical Lean",
            "lean_label": "Frozen 73%",
            "trades": 0,
            "pounds": 0,
            "low": null,
            "high": null,
            "weighted_average": null
          }
        ]
      },
      {
        "market_key": "national",
        "lines": [
          {
            "category": "Chemical Lean",
            "lean_label": "Fresh 75%",
            "trades": 0,
            "pounds": 0,
            "low": null,
            "high": null,
            "weighted_average": null
          },
          {
            "category": "Chemical Lean",
            "lean_label": "Frozen 75%",
            "trades": 0,
            "pounds": 0,
            "low": null,
            "high": null,
            "weighted_average": null
          },
          {
            "category": "Chemical Lean",
            "lean_label": "Fresh 73%",
            "trades": 0,
            "pounds": 0,
            "low": null,
            "high": null,
            "weighted_average": null
          },
          {
            "category": "Chemical Lean",
            "lean_label": "Frozen 73%",
            "trades": 0,
            "pounds": 0,
            "low": null,
            "high": null,
            "weighted_average": null
          },
          {
            "category": "Chemical Lean",
            "lean_label": "Fresh 50%",
            "trades": 15,
            "pounds": 317190,
            "low": 48.0,
            "high": 73.96,
            "weighted_average": 61.18
          },
          {
            "category": "Chemical Lean",
            "lean_label": "Frozen 50%",
            "trades": 0,
            "pounds": 0,
            "low": null,
            "high": null,
            "weighted_average": null
          }
        ]
      }
    ]
  }
}